{
  "$schema": "https://json-schema.org/draft/2020-12/schema",
  "$id": "FrontierNodeSetting.json",
  "title": "FrontierNodeSetting",
  "type": "array",
  "items": {
    "type": "object",
    "properties": {
      "Id": {
        "type": "integer",
        "minimum": 101,
        "maximum": 1001
      },
      "Chapter": {
        "type": "integer",
        "minimum": 1,
        "maximum": 10,
        "enum": [
          1,
          2,
          3,
          4,
          5,
          6,
          7,
          8,
          9,
          10
        ]
      },
      "Stageid": {
        "type": "integer",
        "minimum": 10101,
        "maximum": 100101
      },
      "Camp": {
        "type": "integer",
        "minimum": 1,
        "maximum": 6,
        "enum": [
          1,
          2,
          3,
          4,
          5,
          6
        ]
      },
      "X": {
        "type": "integer",
        "minimum": 104,
        "maximum": 3441
      },
      "Y": {
        "type": "integer",
        "minimum": 77,
        "maximum": 2185
      },
      "Frame": {
        "type": "integer",
        "minimum": 1,
        "maximum": 8,
        "enum": [
          1,
          2,
          3,
          4,
          5,
          6,
          7,
          8
        ]
      },
      "Sea": {
        "type": "integer",
        "minimum": 0,
        "maximum": 1,
        "enum": [
          0,
          1
        ]
      }
    },
    "required": [
      "Id",
      "Chapter",
      "Stageid",
      "Camp",
      "X",
      "Y",
      "Frame",
      "Sea"
    ],
    "additionalProperties": false
  }
}
